{
  "profile_id": "n78_wa_cat_a_100m_30k_midchannel_r18",
  "dut": {
    "band": "n78",
    "bs_type": "1-C",
    "bs_class": "wide_area",
    "emission_category": "A",
    "carrier_center": {
      "value": 3550.0,
      "unit": "MHz"
    },
    "channel_bandwidth": {
      "value": 100.0,
      "unit": "MHz"
    },
    "subcarrier_spacing": {
      "value": 30.0,
      "unit": "kHz"
    },
    "rated_output_power": {
      "value": 46.0,
      "unit": "dBm"
    },
    "test_model": "NR-FR1-TM1.1"
  },
  "scans": [
    {
      "test_model": "NR-FR1-TM1.1",
      "region": {
        "side": "lower",
        "start_offset": {
          "value": 50000,
          "unit": "Hz"
        },
        "stop_offset": {
          "value": 5050000,
          "unit": "Hz"
        },
        "step": {
          "value": 100000,
          "unit": "Hz"
        },
        "measurement_bandwidth": {
          "value": 100000,
          "unit": "Hz"
        }
      },
      "analyzer": {
        "center_frequency": {
          "value": 3550,
          "unit": "MHz"
        },
        "span": {
          "value": 580,
          "unit": "MHz"
        },
        "rbw": {
          "value": 100000,
          "unit": "Hz"
        },
        "vbw": {
          "value": 100000,
          "unit": "Hz"
        },
        "detector": "true_rms",
        "averaging_domain": "power",
        "attenuation": {
          "value": 10,
          "unit": "dB"
        },
        "reference_level": {
          "value": 10,
          "unit": "dBm"
        },
        "preamp_enabled": false
      }
    },
    {
      "test_model": "NR-FR1-TM1.1",
      "region": {
        "side": "lower",
        "start_offset": {
          "value": 5050000,
          "unit": "Hz"
        },
        "stop_offset": {
          "value": 10050000,
          "unit": "Hz"
        },
        "step": {
          "value": 100000,
          "unit": "Hz"
        },
        "measurement_bandwidth": {
          "value": 100000,
          "unit": "Hz"
        }
      },
      "analyzer": {
        "center_frequency": {
          "value": 3550,
          "unit": "MHz"
        },
        "span": {
          "value": 580,
          "unit": "MHz"
        },
        "rbw": {
          "value": 100000,
          "unit": "Hz"
        },
        "vbw": {
          "value": 100000,
          "unit": "Hz"
        },
        "detector": "true_rms",
        "averaging_domain": "power",
        "attenuation": {
          "value": 10,
          "unit": "dB"
        },
        "reference_level": {
          "value": 10,
          "unit": "dBm"
        },
        "preamp_enabled": false
      }
    },
    {
      "test_model": "NR-FR1-TM1.1",
      "region": {
        "side": "lower",
        "start_offset": {
          "value": 10500000,
          "unit": "Hz"
        },
        "stop_offset": {
          "value": 240000000,
          "unit": "Hz"
        },
        "step": {
          "value": 1000000,
          "unit": "Hz"
        },
        "measurement_bandwidth": {
          "value": 1000000,
          "unit": "Hz"
        }
      },
      "analyzer": {
        "center_frequency": {
          "value": 3550,
          "unit": "MHz"
        },
        "span": {
          "value": 580,
          "unit": "MHz"
        },
        "rbw": {
          "value": 1000000,
          "unit": "Hz"
        },
        "vbw": {
          "value": 1000000,
          "unit": "Hz"
        },
        "detector": "true_rms",
        "averaging_domain": "power",
        "attenuation": {
          "value": 10,
          "unit": "dB"
        },
        "reference_level": {
          "value": 10,
          "unit": "dBm"
        },
        "preamp_enabled": false
      }
    },
    {
      "test_model": "NR-FR1-TM1.1",
      "region": {
        "side": "upper",
        "start_offset": {
          "value": 50000,
          "unit": "Hz"
        },
        "stop_offset": {
          "value": 5050000,
          "unit": "Hz"
        },
        "step": {
          "value": 100000,
          "unit": "Hz"
        },
        "measurement_bandwidth": {
          "value": 100000,
          "unit": "Hz"
        }
      },
      "analyzer": {
        "center_frequency": {
          "value": 3550,
          "unit": "MHz"
        },
        "span": {
          "value": 580,
          "unit": "MHz"
        },
        "rbw": {
          "value": 100000,
          "unit": "Hz"
        },
        "vbw": {
          "value": 100000,
          "unit": "Hz"
        },
        "detector": "true_rms",
        "averaging_domain": "power",
        "attenuation": {
          "value": 10,
          "unit": "dB"
        },
        "reference_level": {
          "value": 10,
          "unit": "dBm"
        },
        "preamp_enabled": false
      }
    },
    {
      "test_model": "NR-FR1-TM1.1",
      "region": {
        "side": "upper",
        "start_offset": {
          "value": 5050000,
          "unit": "Hz"
        },
        "stop_offset": {
          "value": 10050000,
          "unit": "Hz"
        },
        "step": {
          "value": 100000,
          "unit": "Hz"
        },
        "measurement_bandwidth": {
          "value": 100000,
          "unit": "Hz"
        }
      },
      "analyzer": {
        "center_frequency": {
          "value": 3550,
          "unit": "MHz"
        },
        "span": {
          "value": 580,
          "unit": "MHz"
        },
        "rbw": {
          "value": 100000,
          "unit": "Hz"
        },
        "vbw": {
          "value": 100000,
          "unit": "Hz"
        },
        "detector": "true_rms",
        "averaging_domain": "power",
        "attenuation": {
          "value": 10,
          "unit": "dB"
        },
        "reference_level": {
          "value": 10,
          "unit": "dBm"
        },
        "preamp_enabled": false
      }
    },
    {
      "test_model": "NR-FR1-TM1.1",
      "region": {
        "side": "upper",
        "start_offset": {
          "value": 10500000,
          "unit": "Hz"
        },
        "stop_offset": {
          "value": 240000000,
          "unit": "Hz"
        },
        "step": {
          "value": 1000000,
          "unit": "Hz"
        },
        "measurement_bandwidth": {
          "value": 1000000,
          "unit": "Hz"
        }
      },
      "analyzer": {
        "center_frequency": {
          "value": 3550,
          "unit": "MHz"
        },
        "span": {
          "value": 580,
          "unit": "MHz"
        },
        "rbw": {
          "value": 1000000,
          "unit": "Hz"
        },
        "vbw": {
          "value": 1000000,
          "unit": "Hz"
        },
        "detector": "true_rms",
        "averaging_domain": "power",
        "attenuation": {
          "value": 10,
          "unit": "dB"
        },
        "reference_level": {
          "value": 10,
          "unit": "dBm"
        },
        "preamp_enabled": false
      }
    },
    {
      "test_model": "NR-FR1-TM1.2",
      "region": {
        "side": "lower",
        "start_offset": {
          "value": 50000,
          "unit": "Hz"
        },
        "stop_offset": {
          "value": 5050000,
          "unit": "Hz"
        },
        "step": {
          "value": 100000,
          "unit": "Hz"
        },
        "measurement_bandwidth": {
          "value": 100000,
          "unit": "Hz"
        }
      },
      "analyzer": {
        "center_frequency": {
          "value": 3550,
          "unit": "MHz"
        },
        "span": {
          "value": 580,
          "unit": "MHz"
        },
        "rbw": {
          "value": 100000,
          "unit": "Hz"
        },
        "vbw": {
          "value": 100000,
          "unit": "Hz"
        },
        "detector": "true_rms",
        "averaging_domain": "power",
        "attenuation": {
          "value": 10,
          "unit": "dB"
        },
        "reference_level": {
          "value": 10,
          "unit": "dBm"
        },
        "preamp_enabled": false
      }
    },
    {
      "test_model": "NR-FR1-TM1.2",
      "region": {
        "side": "lower",
        "start_offset": {
          "value": 5050000,
          "unit": "Hz"
        },
        "stop_offset": {
          "value": 10050000,
          "unit": "Hz"
        },
        "step": {
          "value": 100000,
          "unit": "Hz"
        },
        "measurement_bandwidth": {
          "value": 100000,
          "unit": "Hz"
        }
      },
      "analyzer": {
        "center_frequency": {
          "value": 3550,
          "unit": "MHz"
        },
        "span": {
          "value": 580,
          "unit": "MHz"
        },
        "rbw": {
          "value": 100000,
          "unit": "Hz"
        },
        "vbw": {
          "value": 100000,
          "unit": "Hz"
        },
        "detector": "true_rms",
        "averaging_domain": "power",
        "attenuation": {
          "value": 10,
          "unit": "dB"
        },
        "reference_level": {
          "value": 10,
          "unit": "dBm"
        },
        "preamp_enabled": false
      }
    },
    {
      "test_model": "NR-FR1-TM1.2",
      "region": {
        "side": "lower",
        "start_offset": {
          "value": 10500000,
          "unit": "Hz"
        },
        "stop_offset": {
          "value": 240000000,
          "unit": "Hz"
        },
        "step": {
          "value": 1000000,
          "unit": "Hz"
        },
        "measurement_bandwidth": {
          "value": 1000000,
          "unit": "Hz"
        }